{
  "schemaVersion": 2,
  "caseId": "E06_music",
  "baselineTreatment": "baseline",
  "actualTreatment": "m2b",
  "editor": {
    "summary": {
      "totalObserved": 232,
      "applicable": 232,
      "matches": 186,
      "partial": 7,
      "mismatches": 0,
      "unsupported": 39,
      "errors": 0,
      "excluded": 0,
      "differences": 46,
      "parityPercent": 80.17,
      "classification": "partial"
    },
    "loadErrors": [],
    "properties": [
      {
        "property": "blocks.noUnexpectedTypes",
        "status": "match",
        "expected": [],
        "actual": []
      },
      {
        "property": "blocks.music_pitch.registered",
        "status": "match",
        "expected": true,
        "actual": true
      },
      {
        "property": "blocks.music_pitch.inputOrder",
        "status": "match",
        "expected": [
          "dummy:"
        ],
        "actual": [
          "dummy:"
        ]
      },
      {
        "property": "blocks.music_pitch.connections.previous",
        "status": "match",
        "expected": null,
        "actual": null
      },
      {
        "property": "blocks.music_pitch.connections.next",
        "status": "match",
        "expected": null,
        "actual": null
      },
      {
        "property": "blocks.music_pitch.connections.output",
        "status": "match",
        "expected": {
          "check": [
            "Number"
          ]
        },
        "actual": {
          "check": [
            "Number"
          ]
        }
      },
      {
        "property": "blocks.music_pitch.inputsInline",
        "status": "match",
        "expected": false,
        "actual": false
      },
      {
        "property": "blocks.music_pitch.colour",
        "status": "match",
        "expected": "#5b67a5",
        "actual": "#5b67a5"
      },
      {
        "property": "blocks.music_pitch.tooltip",
        "status": "match",
        "expected": "One note (C4 is 7).",
        "actual": "One note (C4 is 7)."
      },
      {
        "property": "blocks.music_pitch.helpUrl",
        "status": "match",
        "expected": null,
        "actual": null
      },
      {
        "property": "blocks.music_pitch.dynamicBehaviour",
        "status": "partial",
        "expected": [
          "pitch-note-conversion",
          "pitch-picker",
          "pitch-range-validation"
        ],
        "actual": [],
        "capability": "custom-pitch-field",
        "boundary": "model2blockly",
        "rationale": "El campo numérico alternativo conserva el intervalo 0-12, pero no ofrece el selector gráfico, la conversión C3-A4 ni la validación propia de FieldPitch."
      },
      {
        "property": "blocks.music_pitch.inputs.dummy:<anonymous>.present",
        "status": "match",
        "expected": true,
        "actual": true
      },
      {
        "property": "blocks.music_pitch.inputs.dummy:<anonymous>.check",
        "status": "match",
        "expected": null,
        "actual": null
      },
      {
        "property": "blocks.music_pitch.inputs.dummy:<anonymous>.alignment",
        "status": "match",
        "expected": -1,
        "actual": -1
      },
      {
        "property": "blocks.music_pitch.inputs.dummy:<anonymous>.fieldOrder",
        "status": "partial",
        "expected": [
          "custom:FieldPitch:PITCH"
        ],
        "actual": [
          "field_number:PITCH"
        ],
        "capability": "custom-pitch-field",
        "boundary": "model2blockly",
        "rationale": "El bloque conserva un campo PITCH en la misma fila, pero lo genera como field_number en lugar de la clase FieldPitch oficial."
      },
      {
        "property": "blocks.music_pitch.inputs.dummy:<anonymous>.fields.0.present",
        "status": "partial",
        "expected": true,
        "actual": false,
        "capability": "custom-pitch-field",
        "boundary": "model2blockly",
        "rationale": "No existe un campo del mismo tipo personalizado que pueda emparejarse con FieldPitch; el campo numérico alternativo queda reflejado en el orden de campos."
      },
      {
        "property": "blocks.music_note.registered",
        "status": "match",
        "expected": true,
        "actual": true
      },
      {
        "property": "blocks.music_note.inputOrder",
        "status": "match",
        "expected": [
          "value:PITCH"
        ],
        "actual": [
          "value:PITCH"
        ]
      },
      {
        "property": "blocks.music_note.connections.previous",
        "status": "unsupported",
        "expected": {
          "check": null
        },
        "actual": {
          "check": [
            "MusicCommand"
          ]
        },
        "capability": "connection-policy",
        "boundary": "model2blockly",
        "rationale": "La jerarquía MusicCommand necesaria para admitir notas, silencios e instrumentos deriva conexiones tipadas, mientras que Music usa conexiones de sentencia sin tipo."
      },
      {
        "property": "blocks.music_note.connections.next",
        "status": "unsupported",
        "expected": {
          "check": null
        },
        "actual": {
          "check": [
            "MusicCommand"
          ]
        },
        "capability": "connection-policy",
        "boundary": "model2blockly",
        "rationale": "La jerarquía MusicCommand necesaria para admitir notas, silencios e instrumentos deriva conexiones tipadas, mientras que Music usa conexiones de sentencia sin tipo."
      },
      {
        "property": "blocks.music_note.connections.output",
        "status": "match",
        "expected": null,
        "actual": null
      },
      {
        "property": "blocks.music_note.inputsInline",
        "status": "match",
        "expected": true,
        "actual": true
      },
      {
        "property": "blocks.music_note.colour",
        "status": "match",
        "expected": "#5ba58c",
        "actual": "#5ba58c"
      },
      {
        "property": "blocks.music_note.tooltip",
        "status": "match",
        "expected": "Plays one musical note of the specified duration and pitch.",
        "actual": "Plays one musical note of the specified duration and pitch."
      },
      {
        "property": "blocks.music_note.helpUrl",
        "status": "match",
        "expected": null,
        "actual": null
      },
      {
        "property": "blocks.music_note.dynamicBehaviour",
        "status": "match",
        "expected": [],
        "actual": []
      },
      {
        "property": "blocks.music_note.inputs.value:PITCH.present",
        "status": "match",
        "expected": true,
        "actual": true
      },
      {
        "property": "blocks.music_note.inputs.value:PITCH.check",
        "status": "match",
        "expected": [
          "Number"
        ],
        "actual": [
          "Number"
        ]
      },
      {
        "property": "blocks.music_note.inputs.value:PITCH.alignment",
        "status": "match",
        "expected": -1,
        "actual": -1
      },
      {
        "property": "blocks.music_note.inputs.value:PITCH.fieldOrder",
        "status": "match",
        "expected": [
          "field_label:",
          "field_dropdown:DURATION",
          "field_label:"
        ],
        "actual": [
          "field_label:",
          "field_dropdown:DURATION",
          "field_label:"
        ]
      },
      {
        "property": "blocks.music_note.inputs.value:PITCH.fields.0.present",
        "status": "match",
        "expected": true,
        "actual": true
      },
      {
        "property": "blocks.music_note.inputs.value:PITCH.fields.0.name",
        "status": "match",
        "expected": null,
        "actual": null
      },
      {
        "property": "blocks.music_note.inputs.value:PITCH.fields.0.kind",
        "status": "match",
        "expected": "field_label",
        "actual": "field_label"
      },
      {
        "property": "blocks.music_note.inputs.value:PITCH.fields.0.value",
        "status": "match",
        "expected": "play",
        "actual": "play"
      },
      {
        "property": "blocks.music_note.inputs.value:PITCH.fields.0.text",
        "status": "match",
        "expected": "play",
        "actual": "play"
      },
      {
        "property": "blocks.music_note.inputs.value:PITCH.fields.0.options",
        "status": "match",
        "expected": null,
        "actual": null
      },
      {
        "property": "blocks.music_note.inputs.value:PITCH.fields.1.present",
        "status": "match",
        "expected": true,
        "actual": true
      },
      {
        "property": "blocks.music_note.inputs.value:PITCH.fields.1.name",
        "status": "match",
        "expected": "DURATION",
        "actual": "DURATION"
      },
      {
        "property": "blocks.music_note.inputs.value:PITCH.fields.1.kind",
        "status": "match",
        "expected": "field_dropdown",
        "actual": "field_dropdown"
      },
      {
        "property": "blocks.music_note.inputs.value:PITCH.fields.1.value",
        "status": "partial",
        "expected": "1",
        "actual": "whole",
        "capability": "image-dropdown-options",
        "boundary": "model2blockly",
        "rationale": "Se conservan las cinco duraciones y sus etiquetas musicales como texto, pero el DSL no admite imágenes como etiquetas ni valores almacenados numéricos que no sean identificadores de enumeración."
      },
      {
        "property": "blocks.music_note.inputs.value:PITCH.fields.1.text",
        "status": "match",
        "expected": "1/1",
        "actual": "1/1"
      },
      {
        "property": "blocks.music_note.inputs.value:PITCH.fields.1.options",
        "status": "partial",
        "expected": [
          {
            "label": {
              "alt": "1/1",
              "height": 19,
              "src": "music/note1.png",
              "width": 9
            },
            "value": "1"
          },
          {
            "label": {